timestamp,task,e2e_ms,server_duration_ms,steps,tool_calls,success,error_type
17322.038188306,"Search Wikipedia for the stock market, then get financial data for AAPL and GOOGL. Compare the two c",40533.43,40514.35,6,3,True,
17362.57167438,"Search Wikipedia for the stock market, then get financial data for AAPL and GOOGL. Compare the two c",43530.65,43528.3,6,3,True,
17406.102375408,Get financial data for MSFT and compare its P/E ratio to a typical tech stock.,32957.02,32955.03,5,2,True,
17439.059438949,"Get the weather in Tokyo, search Wikipedia for Tokyo, and write a short travel advisory.",43378.24,43376.01,5,2,True,
17482.43772063,What is the weather like in Tokyo right now? Should I pack warm clothes?,29120.49,29118.44,4,1,True,
16928.988845802,Get the current weather in London and tell me if I should bring an umbrella.,24200.62,24196.38,4,1,True,
16936.477232423,Look up financial data for AAPL stock and write a brief investment summary.,37751.63,37747.61,4,1,True,
16943.978872003,"Calculate 15% tip on a $85.50 restaurant bill, then search Wikipedia for tipping customs around the ",36609.63,36606.0,5,2,True,
16953.189515212,Look up financial data for AAPL stock and write a brief investment summary.,31495.69,31493.27,4,1,True,
16974.228922011,What is the weather like in Tokyo right now? Should I pack warm clothes?,26860.7,26858.66,4,1,True,
16966.491432815,Search Wikipedia for the history of Istanbul and summarize the key events in 3 bullet points.,34810.01,34806.47,4,1,True,
16951.479547604,"Look up AAPL financial data. If I invested $5000 at the current price, calculate how many shares I c",51400.15,51396.51,4,1,True,
16984.68526263,Search Wikipedia for artificial intelligence and explain it in simple terms.,24770.62,24768.44,4,1,True,
16958.980196625,"Calculate the compound interest on $10000 at 5% annual rate for 10 years, then search Wikipedia for ",51103.71,51099.94,7,3,True,
16981.501879167,Look up financial data for AAPL stock and write a brief investment summary.,32506.8,32503.06,4,1,True,
16980.588552007,"Get the weather in Tokyo, search Wikipedia for Tokyo, and write a short travel advisory.",34382.96,34380.97,5,2,True,
16973.980469787,"Calculate 15% tip on a $85.50 restaurant bill, then search Wikipedia for tipping customs around the ",45552.11,45548.19,5,2,True,
